{
  "backendSessionId": "fixture-backend-session",
  "buildDigest": "unknown",
  "cancellation": {
    "requests": false,
    "streams": false,
    "supported": false
  },
  "commands": [
    "backend.version",
    "backend.health",
    "backend.capabilities",
    "backend.hello",
    "runner.run",
    "runner.plan",
    "runner.stream",
    "responses.create",
    "ask",
    "askInThread",
    "askWithFiles",
    "askAndDownload",
    "runMessages",
    "openThread",
    "readLatest",
    "copyLatest",
    "downloadLatest",
    "runPlan",
    "doctor",
    "createReport",
    "reports.create",
    "reports.redact",
    "reports.summarize",
    "commands",
    "describe",
    "help",
    "session.bootstrap",
    "experience.detect",
    "experience.open",
    "configuration.inspect",
    "configuration.apply",
    "work.start",
    "work.status",
    "work.wait",
    "work.steer",
    "work.readLatest",
    "threads.new",
    "threads.search",
    "threads.open",
    "messages.compose",
    "messages.submit",
    "messages.ask",
    "messages.wait",
    "messages.readLatest",
    "messages.status",
    "messages.stop",
    "messages.waitAndRead",
    "artifacts.listLatest",
    "artifacts.wait",
    "artifacts.downloadLatest",
    "files.preflight",
    "files.attach",
    "files.downloadLatest",
    "projects.sources.list",
    "projects.sources.planAdd",
    "projects.sources.add",
    "modes.set",
    "modes.get",
    "tools.select",
    "response.copy",
    "operations.submit",
    "operations.collect",
    "operations.inspect",
    "operations.control"
  ],
  "multiplexing": {
    "streams": true,
    "unary": true
  },
  "packageName": "codex-chatgpt-control",
  "packageVersion": "unknown",
  "protocolVersion": "chatgpt.browser_control.backend_request.v1",
  "requestIds": {
    "required": true,
    "scope": "connection"
  },
  "runtime": "node",
  "runtimeVersion": "fixture-runtime",
  "streaming": {
    "modes": [
      "ndjson"
    ],
    "tokenDeltas": false
  },
  "supportedProtocolVersions": [
    "chatgpt.browser_control.backend_request.v1"
  ],
  "tabs": {
    "authoritativeClaim": false,
    "concurrent": false,
    "concurrentTabs": false,
    "coordination": false,
    "coordinationScope": "none",
    "fencing": false,
    "stableBrowserIdentity": false,
    "stableIdentity": false,
    "stableProviderIdentity": false,
    "stableTabIdentity": false
  },
  "transports": [
    "stdio"
  ]
}
